{
 "kind": "outline",
 "locale": "ko",
 "pageId": "revelation-jesus-wins-20261025",
 "producerIdentity": "sentence-first study drafting (DeepSeek agent), 2026-10-25",
 "schemaVersion": "sermon-study-artifact-v1",
 "sections": [
  {
   "body": "요한은 요한계시록 12–13장에서 영적 전쟁을 다섯 장면으로 펼칩니다. 땅에서의 출생과 승리, 하늘의 전쟁, 광야에서의 추격, 그리고 바다와 땅에서 올라온 두 짐승입니다. 이 본문은 긴장되지만 두려움으로 읽지 않습니다. 어느 장면에서도 예수님은 승리자이심을 기억하며 읽습니다.",
   "sourceUnitIds": [
    "asr-u0051",
    "asr-u0052",
    "asr-u0053",
    "asr-u0054",
    "asr-u0055",
    "asr-u0056",
    "asr-u0057",
    "asr-u0058",
    "asr-u0059",
    "asr-u0060",
    "asr-u0061",
    "asr-u0062",
    "asr-u0063",
    "asr-u0064",
    "asr-u0065",
    "asr-u0066",
    "asr-u0067",
    "asr-u0068",
    "asr-u0069",
    "asr-u0070",
    "asr-u0071",
    "asr-u0072",
    "asr-u0073",
    "asr-u0074",
    "asr-u0075",
    "asr-u0076",
    "asr-u0077",
    "asr-u0078",
    "asr-u0079",
    "asr-u0080",
    "asr-u0081",
    "asr-u0082",
    "asr-u0083",
    "asr-u0084",
    "asr-u0085",
    "asr-u0086",
    "asr-u0087",
    "asr-u0088",
    "asr-u0089",
    "asr-u0090",
    "asr-u0091",
    "asr-u0092",
    "asr-u0093",
    "asr-u0094",
    "asr-u0095",
    "asr-u0096",
    "asr-u0097",
    "asr-u0098",
    "asr-u0099",
    "asr-u0100"
   ],
   "title": "전체 환상: 요한계시록 12–13장을 다섯 장면으로 읽기"
  },
  {
   "body": "해를 입은 여자는 하나님의 백성을 나타내고, 그 여자는 해산의 고통 가운데 있습니다. 큰 붉은 용이 아이를 삼키려고 앞에 서 있습니다. 그러나 아이는 태어나자마자 하나님과 그분의 보좌로 올려집니다. 이 장면이 한 문장처럼 빠르게 지나가는 것은 용이 끝내 손을 대지 못했기 때문입니다. 아들이 높임을 받으셨고, 예수님은 승리자이십니다.",
   "sourceUnitIds": [
    "asr-u0054",
    "asr-u0055",
    "asr-u0056",
    "asr-u0057",
    "asr-u0058",
    "asr-u0059",
    "asr-u0060",
    "asr-u0061",
    "asr-u0062",
    "asr-u0063",
    "asr-u0064",
    "asr-u0065",
    "asr-u0066",
    "asr-u0067",
    "asr-u0068",
    "asr-u0069",
    "asr-u0070",
    "asr-u0071",
    "asr-u0072",
    "asr-u0073",
    "asr-u0074",
    "asr-u0075"
   ],
   "title": "첫 장면: 여자와 용 (12:1-6)"
  },
  {
   "body": "미가엘과 그의 천사들이 싸우고, 밤낮으로 형제들을 고발하던 사탄이 내던져집니다. 하늘의 선포는 이렇습니다. 우리가 이긴 것은 어린 양의 피와 우리가 증언한 말씀 때문입니다. 고발의 소리는 사실일 때도 있지만, 예수님의 피가 말하는 것이 원수의 모든 말보다 더 참되고 오래갑니다.",
   "sourceUnitIds": [
    "asr-u0076",
    "asr-u0077",
    "asr-u0078",
    "asr-u0079",
    "asr-u0080",
    "asr-u0081",
    "asr-u0082",
    "asr-u0083",
    "asr-u0084",
    "asr-u0085",
    "asr-u0086",
    "asr-u0087",
    "asr-u0088",
    "asr-u0089",
    "asr-u0090",
    "asr-u0091",
    "asr-u0092",
    "asr-u0093",
    "asr-u0094",
    "asr-u0095",
    "asr-u0096",
    "asr-u0097",
    "asr-u0098",
    "asr-u0099",
    "asr-u0100"
   ],
   "title": "둘째 장면: 하늘의 전쟁 (12:7-12)"
  },
  {
   "body": "용은 자기가 이미 졌음을 알고 여자와 그 후손을 향합니다. 그러나 여자는 큰 독수리의 두 날개를 받아 광야 자기 곳으로 날아가 먹임을 받습니다. 광야는 우리가 지금 사는 자리입니다. 구원은 받았지만 아직 완성되지 않았습니다. 그러나 광야가 길면 길수록 공급도 그만큼 이어집니다.",
   "sourceUnitIds": [
    "asr-u0101",
    "asr-u0102",
    "asr-u0103",
    "asr-u0104",
    "asr-u0105",
    "asr-u0106",
    "asr-u0107",
    "asr-u0108",
    "asr-u0109",
    "asr-u0110",
    "asr-u0111",
    "asr-u0112",
    "asr-u0113",
    "asr-u0114",
    "asr-u0115",
    "asr-u0116",
    "asr-u0117",
    "asr-u0118",
    "asr-u0119",
    "asr-u0120",
    "asr-u0121",
    "asr-u0122",
    "asr-u0123",
    "asr-u0124",
    "asr-u0125"
   ],
   "title": "셋째 장면: 광야의 추격과 공급 (12:13-17)"
  },
  {
   "body": "용은 바다에서 올라온 짐승에게 자기 권세를 넘기고, 땅에서 올라온 짐승은 사람들을 경배하게 하고 표를 받게 합니다. 짐승은 마흔두 달(1260일, 삼 년 반) 동안 권세를 받고 성도들과 싸우도록 허락됩니다. 본문의 단어는 “허락”입니다. 악은 기승을 부리지만 최종 권세자가 아닙니다. 그 날들은 예수님께서 세고 제한하십니다.",
   "sourceUnitIds": [
    "asr-u0126",
    "asr-u0127",
    "asr-u0128",
    "asr-u0129",
    "asr-u0130",
    "asr-u0131",
    "asr-u0132",
    "asr-u0133",
    "asr-u0134",
    "asr-u0135",
    "asr-u0136",
    "asr-u0137",
    "asr-u0138",
    "asr-u0139",
    "asr-u0140",
    "asr-u0141",
    "asr-u0142",
    "asr-u0143",
    "asr-u0144",
    "asr-u0145",
    "asr-u0146",
    "asr-u0147",
    "asr-u0148",
    "asr-u0149",
    "asr-u0150",
    "asr-u0151",
    "asr-u0152",
    "asr-u0153",
    "asr-u0154",
    "asr-u0155",
    "asr-u0156",
    "asr-u0157",
    "asr-u0158",
    "asr-u0159",
    "asr-u0160",
    "asr-u0161",
    "asr-u0162",
    "asr-u0163",
    "asr-u0164",
    "asr-u0165",
    "asr-u0166",
    "asr-u0167",
    "asr-u0168",
    "asr-u0169",
    "asr-u0170",
    "asr-u0171",
    "asr-u0172",
    "asr-u0173",
    "asr-u0174",
    "asr-u0175",
    "asr-u0176",
    "asr-u0177",
    "asr-u0178",
    "asr-u0179",
    "asr-u0180",
    "asr-u0181",
    "asr-u0182",
    "asr-u0183",
    "asr-u0184",
    "asr-u0185",
    "asr-u0186",
    "asr-u0187",
    "asr-u0188",
    "asr-u0189",
    "asr-u0190",
    "asr-u0191",
    "asr-u0192",
    "asr-u0193",
    "asr-u0194",
    "asr-u0195",
    "asr-u0196",
    "asr-u0197",
    "asr-u0198"
   ],
   "title": "넷째·다섯째 장면: 짐승의 권세에도 기한이 있습니다 (13:1-18)"
  },
  {
   "body": "첫째, 예수님은 고발자를 잠잠하게 하십니다(12:10-11). 둘째, 예수님은 그 백성을 먹이십니다(12:14-16). 셋째, 예수님은 악의 기한을 정하십니다(13:5-7). 이 약속은 완벽한 사람이 아니라 광야에 있는 사람을 위한 것입니다. 근거는 우리 믿음의 강도가 아니라 이미 승리하신 그리스도이십니다.",
   "sourceUnitIds": [
    "asr-u0199",
    "asr-u0200",
    "asr-u0201",
    "asr-u0202",
    "asr-u0203",
    "asr-u0204",
    "asr-u0205",
    "asr-u0206",
    "asr-u0207",
    "asr-u0208",
    "asr-u0209",
    "asr-u0210",
    "asr-u0211",
    "asr-u0212",
    "asr-u0213",
    "asr-u0214",
    "asr-u0215",
    "asr-u0216",
    "asr-u0217",
    "asr-u0218",
    "asr-u0219",
    "asr-u0220",
    "asr-u0221",
    "asr-u0222",
    "asr-u0223",
    "asr-u0224",
    "asr-u0225",
    "asr-u0226",
    "asr-u0227",
    "asr-u0228",
    "asr-u0229",
    "asr-u0230",
    "asr-u0231",
    "asr-u0232",
    "asr-u0233",
    "asr-u0234",
    "asr-u0235",
    "asr-u0236",
    "asr-u0237",
    "asr-u0238",
    "asr-u0239",
    "asr-u0240",
    "asr-u0241",
    "asr-u0242",
    "asr-u0243",
    "asr-u0244",
    "asr-u0245",
    "asr-u0246",
    "asr-u0247",
    "asr-u0248",
    "asr-u0249",
    "asr-u0250",
    "asr-u0251",
    "asr-u0252",
    "asr-u0253",
    "asr-u0254",
    "asr-u0255",
    "asr-u0256",
    "asr-u0257",
    "asr-u0258",
    "asr-u0259",
    "asr-u0260",
    "asr-u0261",
    "asr-u0262",
    "asr-u0263",
    "asr-u0264",
    "asr-u0265",
    "asr-u0266",
    "asr-u0267",
    "asr-u0268",
    "asr-u0269",
    "asr-u0270",
    "asr-u0271",
    "asr-u0272",
    "asr-u0273",
    "asr-u0274",
    "asr-u0275",
    "asr-u0276",
    "asr-u0277",
    "asr-u0278",
    "asr-u0279",
    "asr-u0280",
    "asr-u0281",
    "asr-u0282",
    "asr-u0283",
    "asr-u0284",
    "asr-u0285",
    "asr-u0286",
    "asr-u0287",
    "asr-u0288",
    "asr-u0289",
    "asr-u0290",
    "asr-u0291",
    "asr-u0292",
    "asr-u0293",
    "asr-u0294",
    "asr-u0295",
    "asr-u0296",
    "asr-u0297",
    "asr-u0298",
    "asr-u0299",
    "asr-u0300",
    "asr-u0301",
    "asr-u0302",
    "asr-u0303",
    "asr-u0304",
    "asr-u0305",
    "asr-u0306",
    "asr-u0307",
    "asr-u0308",
    "asr-u0309",
    "asr-u0310",
    "asr-u0311",
    "asr-u0312",
    "asr-u0313",
    "asr-u0314",
    "asr-u0315",
    "asr-u0316",
    "asr-u0317",
    "asr-u0318",
    "asr-u0319",
    "asr-u0320",
    "asr-u0321",
    "asr-u0322",
    "asr-u0323",
    "asr-u0324",
    "asr-u0325",
    "asr-u0326",
    "asr-u0327",
    "asr-u0328",
    "asr-u0329",
    "asr-u0330",
    "asr-u0331",
    "asr-u0332",
    "asr-u0333",
    "asr-u0334",
    "asr-u0335",
    "asr-u0336",
    "asr-u0337",
    "asr-u0338",
    "asr-u0339",
    "asr-u0340",
    "asr-u0341",
    "asr-u0342",
    "asr-u0343",
    "asr-u0344",
    "asr-u0345",
    "asr-u0346",
    "asr-u0347",
    "asr-u0348",
    "asr-u0349",
    "asr-u0350",
    "asr-u0351",
    "asr-u0352",
    "asr-u0353",
    "asr-u0354",
    "asr-u0355",
    "asr-u0356",
    "asr-u0357",
    "asr-u0358",
    "asr-u0359",
    "asr-u0360",
    "asr-u0361",
    "asr-u0362",
    "asr-u0363",
    "asr-u0364",
    "asr-u0365",
    "asr-u0366",
    "asr-u0367",
    "asr-u0368",
    "asr-u0369",
    "asr-u0370",
    "asr-u0371",
    "asr-u0372",
    "asr-u0373",
    "asr-u0374",
    "asr-u0375",
    "asr-u0376",
    "asr-u0377",
    "asr-u0378",
    "asr-u0379",
    "asr-u0380",
    "asr-u0381",
    "asr-u0382",
    "asr-u0383",
    "asr-u0384",
    "asr-u0385",
    "asr-u0386",
    "asr-u0387",
    "asr-u0388",
    "asr-u0389"
   ],
   "title": "세 가지 약속 (12:10–13:7)"
  },
  {
   "body": "히틀러는 자기 제국이 천 년을 간다고 말했지만 십이 년을 갔습니다. 로스코는 큰 개를 무서워했지만, 개들이 목줄 안에 있다는 것을 배웠습니다. 원수는 잠시 해를 끼칠 수 있지만 이미 졌습니다. 예수님은 십자가에서 우리의 죄와 수치를 담당하시고, 사흘 만에 부활하시고, 하늘에 오르사 다스리시며, 다시 오셔서 모든 것을 새롭게 하십니다. 우리는 자격 없는 확신으로 광야에서 이 승리하신 왕을 예배합니다.",
   "sourceUnitIds": [
    "asr-u0390",
    "asr-u0391",
    "asr-u0392",
    "asr-u0393",
    "asr-u0394",
    "asr-u0395",
    "asr-u0396",
    "asr-u0397",
    "asr-u0398",
    "asr-u0399",
    "asr-u0400",
    "asr-u0401",
    "asr-u0402",
    "asr-u0403",
    "asr-u0404",
    "asr-u0405",
    "asr-u0406",
    "asr-u0407",
    "asr-u0408",
    "asr-u0409",
    "asr-u0410",
    "asr-u0411",
    "asr-u0412",
    "asr-u0413",
    "asr-u0414",
    "asr-u0415",
    "asr-u0416",
    "asr-u0417",
    "asr-u0418",
    "asr-u0419",
    "asr-u0420",
    "asr-u0421",
    "asr-u0422",
    "asr-u0423",
    "asr-u0424",
    "asr-u0425",
    "asr-u0426",
    "asr-u0427",
    "asr-u0428",
    "asr-u0429",
    "asr-u0430",
    "asr-u0431",
    "asr-u0432",
    "asr-u0433",
    "asr-u0434",
    "asr-u0435",
    "asr-u0436",
    "asr-u0437",
    "asr-u0438",
    "asr-u0439",
    "asr-u0440",
    "asr-u0441",
    "asr-u0442",
    "asr-u0443",
    "asr-u0444",
    "asr-u0445",
    "asr-u0446",
    "asr-u0447"
   ],
   "title": "적용: 광야에서도 자격 없는 확신으로"
  }
 ],
 "sourcePackageSha256": "199e4b86e58c6456c462b41e359e72f3ccc61ad59bd78e296e8e8a8717504d35",
 "textCandidateSha256": "232433d1e2eceed114c13fc475d90c44c6b1447995c340bbf88049541831a152"
}
